{"$schema":"https://json-schema.org/draft/2020-12/schema","type":"object","additionalProperties":false,"required":["registry_version","generated_at","authority_ranking","sources"],"properties":{"registry_version":{"type":"string"},"generated_at":{"type":"string","format":"date"},"authority_ranking":{"type":"array","items":{"type":"object","required":["level","rank","description"],"properties":{"level":{"enum":["primary","official_guidance","court_authority","official_operational","provider","secondary"]},"rank":{"type":"integer","minimum":1},"description":{"type":"string"}},"additionalProperties":false}},"sources":{"type":"array","items":{"$ref":"source-entry.schema.json"}}}}